[
  {
    "source_adapter_id": "src_adapter_national_registry_sg_acra_demo_v1",
    "source_family": "national_registry",
    "source_system": "national-registry-demo",
    "source_dataset": "sg_company_registry_extract",
    "ingestion_mode": "registry_snapshot",
    "payload_format": "json",
    "country_scope": ["SG"],
    "provider_or_source_id_role": "sovereign_candidate_when_official",
    "identity_key_policy": "sovereign_candidate_official_only",
    "approved_fact_types": ["company_identity", "official_identifier", "legal_status", "location"],
    "license_or_use_basis": "public-registry-demo-use",
    "allowed_use": "identity verification, official identifier evidence, and firmographic source citation",
    "retention_policy": "retain governed metadata and evidence excerpts only for demo validation",
    "redistribution_allowed": false,
    "row_level_identity_allowed": true,
    "refresh_sla": "monthly or on-demand before customer demo",
    "approval_status": "approved_for_demo",
    "run_metadata_required": {
      "run_id": true,
      "run_timestamp": true,
      "source_retrieved_at": true,
      "license_or_contract_reference": true
    },
    "lineage_required": true,
    "governance_owner": "Pulse360 Data Foundation",
    "last_reviewed_at": "2026-05-08",
    "notes": "Official registry values may become sovereign identifier candidates only when source evidence is official and confidence gates pass."
  },
  {
    "source_adapter_id": "src_adapter_marketplace_firmographic_delta_share_demo_v1",
    "source_family": "commercial_provider_marketplace",
    "source_system": "databricks-marketplace-provider-demo",
    "source_dataset": "commercial_firmographic_delta_share",
    "ingestion_mode": "marketplace_delta_share",
    "payload_format": "delta_table",
    "country_scope": ["US", "GB", "SG", "AU", "PH"],
    "provider_or_source_id_role": "xref_only",
    "identity_key_policy": "xref_only",
    "approved_fact_types": [
      "company_identity",
      "location",
      "classification",
      "financial",
      "workforce_scale",
      "hierarchy_hint",
      "contact_web_presence",
      "digital_signal"
    ],
    "license_or_use_basis": "provider-contract-required",
    "allowed_use": "firmographic enrichment and source comparison after commercial entitlement approval",
    "retention_policy": "retain according to provider contract and Databricks Marketplace terms",
    "redistribution_allowed": false,
    "row_level_identity_allowed": true,
    "refresh_sla": "provider entitlement schedule",
    "approval_status": "gated_contract_required",
    "run_metadata_required": {
      "run_id": true,
      "run_timestamp": true,
      "source_retrieved_at": true,
      "license_or_contract_reference": true
    },
    "lineage_required": true,
    "governance_owner": "Pulse360 Data Foundation",
    "last_reviewed_at": "2026-05-08",
    "notes": "Commercial provider record IDs are xrefs only. They must never replace CRM account IDs or official sovereign identifiers."
  },
  {
    "source_adapter_id": "src_adapter_customer_internal_lakeflow_demo_v1",
    "source_family": "customer_internal",
    "source_system": "customer-internal-approved-connector",
    "source_dataset": "customer_master_or_erp_firmographics",
    "ingestion_mode": "lakeflow_connect",
    "payload_format": "delta_table",
    "country_scope": ["US", "GB", "SG", "AU", "PH"],
    "provider_or_source_id_role": "crm_safe_join_only",
    "identity_key_policy": "crm_safe_join_only",
    "approved_fact_types": ["company_identity", "financial", "workforce_scale", "hierarchy_hint", "digital_signal"],
    "license_or_use_basis": "customer-data-processing-agreement-required",
    "allowed_use": "customer-owned enrichment and reconciliation against CRM-safe account keys",
    "retention_policy": "retain under customer data processing agreement and environment policy",
    "redistribution_allowed": false,
    "row_level_identity_allowed": true,
    "refresh_sla": "customer connector schedule",
    "approval_status": "gated_contract_required",
    "run_metadata_required": {
      "run_id": true,
      "run_timestamp": true,
      "source_retrieved_at": true,
      "license_or_contract_reference": true
    },
    "lineage_required": true,
    "governance_owner": "Pulse360 Data Foundation",
    "last_reviewed_at": "2026-05-08",
    "notes": "Internal system keys join through CRM-safe activation keys or approved xrefs only."
  },
  {
    "source_adapter_id": "src_adapter_internet_research_document_extraction_demo_v1",
    "source_family": "internet_research",
    "source_system": "governed-public-research-pipeline",
    "source_dataset": "approved_public_documents",
    "ingestion_mode": "document_extraction",
    "payload_format": "pdf_text",
    "country_scope": ["US", "GB", "SG", "AU", "PH", "ZZ"],
    "provider_or_source_id_role": "evidence_only",
    "identity_key_policy": "evidence_only",
    "approved_fact_types": [
      "company_identity",
      "official_identifier",
      "location",
      "classification",
      "legal_status",
      "financial",
      "hierarchy_hint",
      "contact_web_presence"
    ],
    "license_or_use_basis": "public-source-demo-use",
    "allowed_use": "source-bound research evidence, investor summaries, and GPT extraction input",
    "retention_policy": "retain URL, source metadata, short excerpts, retrieval timestamp, and derived facts",
    "redistribution_allowed": false,
    "row_level_identity_allowed": true,
    "refresh_sla": "on-demand per enrichment run",
    "approval_status": "approved_for_demo",
    "run_metadata_required": {
      "run_id": true,
      "run_timestamp": true,
      "source_retrieved_at": true,
      "license_or_contract_reference": true
    },
    "lineage_required": true,
    "governance_owner": "Pulse360 Data Foundation",
    "last_reviewed_at": "2026-05-08",
    "notes": "Discovery must use CRM/source country anchors when available to avoid jurisdiction drift from search-result spelling correction."
  },
  {
    "source_adapter_id": "src_adapter_clean_room_collaboration_demo_v1",
    "source_family": "clean_room_collaboration",
    "source_system": "databricks-clean-room-demo",
    "source_dataset": "collaborative_account_signal_output",
    "ingestion_mode": "clean_room_output",
    "payload_format": "aggregate_table",
    "country_scope": ["US", "GB", "SG", "AU", "PH"],
    "provider_or_source_id_role": "aggregate_signal_only",
    "identity_key_policy": "aggregate_only",
    "approved_fact_types": ["aggregate_signal", "digital_signal"],
    "license_or_use_basis": "clean-room-agreement-required",
    "allowed_use": "aggregate validation and account segment signal enrichment after collaboration approval",
    "retention_policy": "retain only approved clean-room output columns and no raw partner data",
    "redistribution_allowed": false,
    "row_level_identity_allowed": false,
    "refresh_sla": "collaboration agreement schedule",
    "approval_status": "gated_contract_required",
    "run_metadata_required": {
      "run_id": true,
      "run_timestamp": true,
      "source_retrieved_at": true,
      "license_or_contract_reference": true
    },
    "lineage_required": true,
    "governance_owner": "Pulse360 Data Foundation",
    "last_reviewed_at": "2026-05-08",
    "notes": "Clean room outputs are aggregate or permitted signal facts only unless a separate row-level identity use case is explicitly approved."
  }
]
